{
  "schema_version": "1",
  "event_type": "FILE_STABLE",
  "relative_path": "EMPRESA EXEMPLO\\Escrita Fiscal\\07-2026\\Guias - Impostos e Parcelamentos\\DAS 07-2026.pdf",
  "file_name": "DAS 07-2026.pdf",
  "file_sha256": "0123456789abcdef0123456789abcdef0123456789abcdef0123456789abcdef",
  "file_size": 12345,
  "detected_at": "2026-08-28T18:00:00-03:00",
  "folder_period": "2026-07",
  "folder_company": "EMPRESA EXEMPLO",
  "classifier_hint": "DAS",
  "pdf_probe": {
    "is_pdf": true,
    "page_count": 1,
    "has_extractable_text": true,
    "text_length": 1234
  }
}
